{
  "$schema": "../schemas/economic-simulation-suite.schema.json",
  "schema_version": "somavera.economic-simulation-suite.v1",
  "engine_profile": "somavera-economic-simulator-integer-v1",
  "corpus_status": "synthetic_unattested",
  "quote_unit_id": "synthetic-quote-microunit-v1",
  "activation_evidence": {
    "launch_gates": "not_passed",
    "security_review_hash": null,
    "economic_review_hash": null,
    "privacy_review_hash": null,
    "legal_review_hash": null,
    "recovery_report_hash": null,
    "independent_attestation_hash": null
  },
  "limits": {
    "minimum_validator_cost_coverage_basis_points": 12000,
    "maximum_fee_burden_basis_points": 500,
    "maximum_validator_controller_share_basis_points": 3333,
    "maximum_host_controller_share_basis_points": 5000,
    "maximum_sybil_claim_share_basis_points": 1000
  },
  "required_coverage": [
    "accounting_load",
    "ambiguous_double_spend",
    "bootstrap_sunset",
    "bridge_failure",
    "cartel_30_percent",
    "cartel_50_percent",
    "cartel_67_percent",
    "challenger_griefing",
    "demand_at_capacity",
    "demand_excess",
    "demand_low",
    "exact_succession",
    "issuance_empty",
    "issuance_full",
    "liquidity_withdrawal",
    "major_venue_failure",
    "oracle_failure",
    "paymaster_failure",
    "price_down_95_percent",
    "price_down_99_percent",
    "price_near_zero",
    "price_up_100x",
    "price_up_10x",
    "reciprocal_jobs",
    "stablecoin_failure",
    "sybil_procurement",
    "validator_cost_profile_1",
    "validator_cost_profile_2",
    "validator_cost_profile_3",
    "validator_cost_profile_4",
    "validator_cost_profile_5",
    "verifier_bribery",
    "zero_liquidity"
  ],
  "profiles": [
    {
      "profile_id": "capped-no-tail",
      "architecture": "native_token",
      "token_decimals": 9,
      "network_fee_grain_per_service_unit": "1000000",
      "validator_fee_share_basis_points": 8000,
      "validator_issuance_grain_per_period": "150000000000000",
      "external_security_budget_quote_microunits_per_period": "0",
      "native_bond_requirement_grain": "5000000000000",
      "public_intelligence_requires_native_token": false,
      "identity_consent_export_or_exit_requires_native_token": false
    },
    {
      "profile_id": "fee-only-native",
      "architecture": "native_token",
      "token_decimals": 9,
      "network_fee_grain_per_service_unit": "5000000",
      "validator_fee_share_basis_points": 9000,
      "validator_issuance_grain_per_period": "0",
      "external_security_budget_quote_microunits_per_period": "0",
      "native_bond_requirement_grain": "5000000000000",
      "public_intelligence_requires_native_token": false,
      "identity_consent_export_or_exit_requires_native_token": false
    },
    {
      "profile_id": "lower-cap-adaptive",
      "architecture": "native_token",
      "token_decimals": 9,
      "network_fee_grain_per_service_unit": "1000000",
      "validator_fee_share_basis_points": 8000,
      "validator_issuance_grain_per_period": "100000000000000",
      "external_security_budget_quote_microunits_per_period": "0",
      "native_bond_requirement_grain": "2500000000000",
      "public_intelligence_requires_native_token": false,
      "identity_consent_export_or_exit_requires_native_token": false
    },
    {
      "profile_id": "no-native-token-control",
      "architecture": "no_native_token",
      "token_decimals": 0,
      "network_fee_grain_per_service_unit": "0",
      "validator_fee_share_basis_points": 0,
      "validator_issuance_grain_per_period": "0",
      "external_security_budget_quote_microunits_per_period": "250000000000",
      "native_bond_requirement_grain": "0",
      "public_intelligence_requires_native_token": false,
      "identity_consent_export_or_exit_requires_native_token": false
    },
    {
      "profile_id": "scenario-a",
      "architecture": "native_token",
      "token_decimals": 9,
      "network_fee_grain_per_service_unit": "1000000",
      "validator_fee_share_basis_points": 8000,
      "validator_issuance_grain_per_period": "250000000000000",
      "external_security_budget_quote_microunits_per_period": "0",
      "native_bond_requirement_grain": "10000000000000",
      "public_intelligence_requires_native_token": false,
      "identity_consent_export_or_exit_requires_native_token": false
    }
  ],
  "scenarios": [
    {
      "scenario_id": "ambiguous-fork",
      "coverage_tags": ["ambiguous_double_spend"],
      "service_units": "100000",
      "service_value_quote_microunits_per_unit": "1000000",
      "token_price_quote_microunits_per_whole_token": "1000000",
      "validator_operating_cost_quote_microunits": "100000000000",
      "safe_service_capacity_units": "100000",
      "validator_controller_shares_basis_points": [2500, 2500, 2500, 2500],
      "host_controller_shares_basis_points": [4000, 3000, 3000],
      "hostile_validator_power_basis_points": 0,
      "hostile_host_share_basis_points": 0,
      "sybil_claim_share_basis_points": 0,
      "issuance_claim_basis_points": 5000,
      "direct_native_fee_access": true,
      "paymaster_available": true,
      "external_liquidity_available": true,
      "external_settlement_available": true,
      "bootstrap_status": "within_window",
      "succession_status": "ambiguous_double_spend"
    },
    {
      "scenario_id": "bootstrap-and-recovery",
      "coverage_tags": ["bootstrap_sunset", "exact_succession"],
      "service_units": "100000",
      "service_value_quote_microunits_per_unit": "1000000",
      "token_price_quote_microunits_per_whole_token": "1000000",
      "validator_operating_cost_quote_microunits": "100000000000",
      "safe_service_capacity_units": "100000",
      "validator_controller_shares_basis_points": [2500, 2500, 2500, 2500],
      "host_controller_shares_basis_points": [4000, 3000, 3000],
      "hostile_validator_power_basis_points": 0,
      "hostile_host_share_basis_points": 0,
      "sybil_claim_share_basis_points": 0,
      "issuance_claim_basis_points": 5000,
      "direct_native_fee_access": true,
      "paymaster_available": true,
      "external_liquidity_available": true,
      "external_settlement_available": true,
      "bootstrap_status": "sunset_missed",
      "succession_status": "exact_single_context"
    },
    {
      "scenario_id": "cartel-and-full-issuance",
      "coverage_tags": ["cartel_67_percent", "issuance_full"],
      "service_units": "100000",
      "service_value_quote_microunits_per_unit": "1000000",
      "token_price_quote_microunits_per_whole_token": "1000000",
      "validator_operating_cost_quote_microunits": "100000000000",
      "safe_service_capacity_units": "100000",
      "validator_controller_shares_basis_points": [6700, 1100, 1100, 1100],
      "host_controller_shares_basis_points": [6700, 1100, 1100, 1100],
      "hostile_validator_power_basis_points": 6700,
      "hostile_host_share_basis_points": 6700,
      "sybil_claim_share_basis_points": 0,
      "issuance_claim_basis_points": 10000,
      "direct_native_fee_access": true,
      "paymaster_available": true,
      "external_liquidity_available": true,
      "external_settlement_available": true,
      "bootstrap_status": "within_window",
      "succession_status": "not_applicable"
    },
    {
      "scenario_id": "liquidity-collapse",
      "coverage_tags": ["major_venue_failure", "paymaster_failure", "stablecoin_failure", "zero_liquidity"],
      "service_units": "100000",
      "service_value_quote_microunits_per_unit": "1000000",
      "token_price_quote_microunits_per_whole_token": "1000000",
      "validator_operating_cost_quote_microunits": "100000000000",
      "safe_service_capacity_units": "100000",
      "validator_controller_shares_basis_points": [2500, 2500, 2500, 2500],
      "host_controller_shares_basis_points": [4000, 3000, 3000],
      "hostile_validator_power_basis_points": 0,
      "hostile_host_share_basis_points": 0,
      "sybil_claim_share_basis_points": 0,
      "issuance_claim_basis_points": 5000,
      "direct_native_fee_access": false,
      "paymaster_available": false,
      "external_liquidity_available": false,
      "external_settlement_available": false,
      "bootstrap_status": "within_window",
      "succession_status": "not_applicable"
    },
    {
      "scenario_id": "liquidity-withdrawal",
      "coverage_tags": ["bridge_failure", "liquidity_withdrawal", "oracle_failure"],
      "service_units": "100000",
      "service_value_quote_microunits_per_unit": "1000000",
      "token_price_quote_microunits_per_whole_token": "1000000",
      "validator_operating_cost_quote_microunits": "100000000000",
      "safe_service_capacity_units": "100000",
      "validator_controller_shares_basis_points": [2500, 2500, 2500, 2500],
      "host_controller_shares_basis_points": [4000, 3000, 3000],
      "hostile_validator_power_basis_points": 0,
      "hostile_host_share_basis_points": 0,
      "sybil_claim_share_basis_points": 0,
      "issuance_claim_basis_points": 5000,
      "direct_native_fee_access": false,
      "paymaster_available": true,
      "external_liquidity_available": false,
      "external_settlement_available": true,
      "bootstrap_status": "within_window",
      "succession_status": "not_applicable"
    },
    {
      "scenario_id": "price-down-95",
      "coverage_tags": ["demand_low", "issuance_empty", "price_down_95_percent", "validator_cost_profile_1"],
      "service_units": "10000",
      "service_value_quote_microunits_per_unit": "1000000",
      "token_price_quote_microunits_per_whole_token": "50000",
      "validator_operating_cost_quote_microunits": "50000000000",
      "safe_service_capacity_units": "100000",
      "validator_controller_shares_basis_points": [2500, 2500, 2500, 2500],
      "host_controller_shares_basis_points": [4000, 3000, 3000],
      "hostile_validator_power_basis_points": 0,
      "hostile_host_share_basis_points": 0,
      "sybil_claim_share_basis_points": 0,